id,title,subtitle,slug,lead,content,image,type,custom_field,parent_id,created_at,updated_at,added_timestamp,language,seo_title,seo_content,seo_title_desc,seo_content_desc,category_id,1,"MANDARIN ORIENTAL, MIAMI CELEBRATES 25 YEARS OF LUXURY HOSPITALITY EXCELLENCE AND EMBRACES A VISION FOR THE FUTURE.",19 Dec 2024,"<p>HONG KONG – 19 December 2024 — Mandarin Oriental, Miami marks its 25th year as the gold standard in luxury hospitality with a heartfelt celebration of its legacy. Closing on May 31, 2025, the hotel offers guests a final opportunity to experience its iconic dining, spa, and cultural offerings through a series of thoughtfully curated events.</p>

<p>Recognising the loyalty of our guests and promising a vision for the future, Mandarin Oriental, Miami concludes this chapter with optimism, leaving behind unforgettable memories and teases what lies ahead for the brand in Miami: an entirely new Mandarin Oriental, Miami and The Residences at Mandarin Oriental, Miami, set to debut in 2030.</p>

<p>A Legacy of Legendary Service has been the hallmark of Mandarin Oriental, Miami since its grand opening in 2000. The hotel has earned a reputation for excellence, routinely topping Editor and Readers' Choice Awards in top Travel publications. It has also been celebrated with Forbes 5-Star accolades for both the hotel and the spa, consistently recognized as offering the Best Dining in Miami.</p>

<p>A vibrant centrepiece of Miami’s cultural and culinary scene, the hotel has been the destination of choice for global celebrities, including Will Smith, John Legend, and Chrissy Teigen. “For 25 years, Mandarin Oriental, Miami has been a beloved part of this vibrant city. We are deeply grateful to our guests, colleagues, and the Miami community for their loyalty and support,” said Flavia Daudan-Caponi, General Manager of Mandarin Oriental, Miami and Area Vice President, Operations.</p>

<p>“As we close this chapter, we look forward to celebrating our legacy and welcoming everyone to experience a haven of craftsmanship and culture for one last time.”</p>",information/QqkRLCF1Ac.jpg,19 Dec 2024.1,2024-12-30 11:29:35,19 Dec 2024.2,en,100
1.0,MINT Moves to Delist Minor Hotels Shares in Europe and the Americas via Tender Offer,<p>MINT has initiated a tender offer aimed at removing Minor Hotels shares from the market in Europe and the Americas. This strategic decision reflects the company's evolving focus and market considerations. The move is expected to impact shareholders and reshape the investment landscape in these regions.</p>,mint-moves-to-delist-minor-hotels-shares-in-europe-and-the-americas-via-tender-offer,,"<p>Minor International Public Company Limited (MINT), the parent company of Minor Hotels, announced on December 13, 2024, that the Board of Directors of Minor Hotels Europe & Americas (MHEA), formerly known as NH Hotel Group, issued a favorable report regarding an offer made by MHG Continental Holding (Singapore), a wholly-owned subsidiary of MINT, to delist MHEA shares via a tender offer.</p>

<p>MHG currently holds a 95.9% interest in MHEA. Following the positive Board report, the proposal will be presented to shareholders at an Extraordinary General Meeting (EGM) of MHEA’s shareholders, anticipated to occur around January 20, 2025.</p>

<p>The delisting offer proposal is priced at EUR 6.37 per share, supported by an independent valuation. This proposal complies with Spanish regulations, and the delisting tender offer must be approved by the Spanish securities regulator (CNMV) before being formally extended to shareholders.</p>

<p>The aim of the proposal is to provide MHEA's minority shareholders with an attractive exit opportunity while offering enhanced asset and capital management flexibility to MINT. This strategic move is designed to benefit both MINT’s and MHEA’s shareholders.</p>

<p>If shareholders approve the proposal at the EGM, it will be submitted to the CNMV for review, with the tender offer and delisting targeted for completion in the first quarter of 2025, pending CNMV approval. This transaction is the latest chapter in MINT’s progressive acquisition of MHEA since its initial investments in 2018, underscoring its commitment to good governance and value creation for stakeholders.</p>

<p>Minor International (MINT) focuses on two core businesses: hospitality and restaurants. It is a significant hotel owner, operator, and investor with over 560 hotels under various brands, including Anantara, Avani, and Tivoli, in 57 countries. Additionally, MINT is one of Asia’s largest restaurant companies, operating over 2,600 outlets in 24 countries.</p>

<p>Minor Hotels operates over 560 hotels, resorts, and residences worldwide, embodying a vision of crafting a more passionate and interconnected world. With a diverse portfolio, Minor Hotels aims to add more than 200 hotels by 2026, showcasing its ambitious growth strategy.</p>

<p>As a proud member of the Global Hotel Alliance (GHA), Minor",information/vIuKVXZhuF.jpg,,,,16 Dec 2024,2024-12-30 10:59:01.252072,16 Dec 2024,en,,,,,100.0,,,,,,,,,,
,Sonesta White Plains Downtown Reveals Stunning Transformation,"<p>After an extensive renovation, Sonesta White Plains Downtown has undergone a remarkable makeover. This revitalized hotel showcases modern design elements and enhanced amenities. Guests can now experience a fresh and inviting atmosphere during their stay.</p>",sonesta-white-plains-downtown-reveals-stunning-transformation,,"<p>Centrally located in Westchester, a newly revamped hotel has emerged, promising a dynamic experience for travelers. This revitalization aims to cater to both business and leisure visitors, ensuring they have everything they need for a memorable stay.</p>

<p>The hotel’s renovation includes modern amenities and stylish decor, designed to enhance the overall guest experience. Whether it’s for a weekend getaway or a business trip, the atmosphere is tailored to meet the needs of diverse travelers.</p>

<p>One of the hotel’s standout features is its seamless access to New York City and the picturesque Hudson Valley. Guests can easily explore the vibrant urban landscape or take a short trip to enjoy the scenic beauty of the valley.</p>

<p>This strategic location makes it an ideal hub for those looking to experience the best of both worlds. The hotel offers shuttle services and transportation options, making commutes hassle-free for its guests.</p>

<p>In addition to its prime location, the hotel boasts a range of amenities, including state-of-the-art fitness facilities, a business center, and exquisite dining options. These features are designed to ensure that every guest’s needs are met during their stay.</p>

<p>Local attractions and cultural experiences are also easily accessible, allowing guests to immerse themselves in the rich history and vibrant arts scene of the area. Special packages and promotions are available to encourage visitors to explore these nearby destinations.</p>

<p>With a focus on sustainability, the hotel has implemented eco-friendly practices throughout its operations. This initiative not only contributes to environmental preservation but also appeals to travelers who prioritize sustainable choices.</p>

<p>Overall, the renewed Westchester hotel is set to redefine the travel experience for its guests. By combining modern comforts with a strategic location, it aims to become a top choice for those visiting the New York metropolitan area.</p>

<p>As travelers increasingly seek unique and convenient accommodations, this hotel is poised to meet those demands head-on. With its commitment to quality and guest satisfaction, it is ready to welcome visitors from near and far.</p>",information/8q3Oo18oHV.jpg,,,,10 Dec 2024,1735544832.299333,10 Dec 2024,,,,,,100.0,,,,,,,,,,
1.0,ICEHOTEL 35 Unveiled: A Mesmerizing Glimpse into Its Captivating Interior.,"Discover the enchanting design and artistry that define ICEHOTEL 35. This stunning structure showcases a unique blend of ice and creativity, offering visitors an unforgettable experience. Step inside to explore the intricate details and breathtaking ambiance that make it a true winter wonderland.",icehotel-35-unveiled:-a-mesmerizing-glimpse-into-its-captivating-interior.,,,information/nBkUmYQERj.jpg,,,,20 Dec 2024,2024-12-30 11:00:32,20 Dec 2024,en,,,,,100.0,,,,,,,,,,
1.0,ICEHOTEL 35 Opens Its Doors: Discover the Breathtaking Interiors!,<p>Experience the enchanting ambiance of ICEHOTEL 35 as it welcomes visitors for the new season. Explore the stunning craftsmanship and intricate designs that redefine winter accommodations. This unique destination promises an unforgettable journey into the heart of icy artistry.</p>,icehotel-35-opens-its-doors:-discover-the-breathtaking-interiors!,,,information/Vfj5zIrDRD.jpg,,,,20 Dec 2024,2024-12-30 11:01:41,20 Dec 2024,en,,,,,100.0,,,,,,,,,,
1.0,ICEHOTEL 35 Opens Its Doors: Discover the Breathtaking Interior for This Season!,"ICEHOTEL 35 is now welcoming visitors, showcasing its stunning design and artistry for the current season. Experience the unique ambiance created by talented artists and craftsmen. This year’s edition promises to captivate guests with its intricate ice sculptures and breathtaking architecture.",icehotel-35-opens-its-doors:-discover-the-breathtaking-interior-for-this-season!,,,information/JA6Ju0H9Dz.jpg,,,,20 Dec 2024,2024-12-30 11:03:10,20 Dec 2024,en,,,,,100.0,,,,,,,,,,
,Experience the Lunar New Year Celebration at The Peninsula London!,"Join us for a vibrant celebration of the Lunar New Year at The Peninsula London. Immerse yourself in a rich cultural experience filled with traditional festivities, delicious cuisine, and captivating performances. Don't miss this opportunity to celebrate the Year of the Rabbit in style!",experience-the-lunar-new-year-celebration-at-the-peninsula-london!,,"<p>Step into the enchanting world of Lunar New Year at The Peninsula London, where fascinating traditions and sophisticated hospitality come together in celebration of the Year of the Snake. From Saturday, 18th January to Saturday, 8th February, the hotel will offer an array of immersive experiences, from auspicious festivities to entertaining dining and cultural masterclasses, all inspired by The Peninsula’s rich Asian heritage.</p>

<p>A Feast of Fortune at ‘Canton Red’ will greet visitors during the Lunar New Year period, as Canton Blue, the Peninsula’s refined Cantonese restaurant, transforms into 'Canton Red' from 18th January to 8th February. The color red, sacred in Chinese culture, symbolizes good fortune, prosperity, happiness, and vitality. The restaurant’s glossy blue entrance doors will be adorned with red decorations, and the interiors will feature vibrant red florals and luminous Chinese lanterns. Diners are invited to celebrate the Lunar New Year with an exclusive menu crafted to honor the season.</p>

<p>The festive menu includes innovative interpretations of culturally significant dishes. Guests dining at Canton Red will also receive a traditional red envelope. On 29th January, a Chinese calligrapher will create bespoke messages of prosperity for the year ahead. The three-course set menu is available for £188 per person (exclusive of drinks) for both lunch and dinner sittings.</p>

<p>Additionally, Canton Red’s elegant Tea Lounge will host daily Chinese tea masterclasses from 3:30 pm to 4:30 pm, running from Saturday, 25th January to Wednesday, 5th February. Led by The Peninsula London’s expert tea masters, each session includes tastings of three teas, paired with light dim sum, pastries, and traditional sweets.</p>

<p>Participants will learn the history and techniques of this ancient ritual while experiencing its sensational flavors. This intimate experience, ideal for family and friends, is limited to eight participants per session and can be reserved on SevenRooms.com for £48 per person.</p>

<p>On Wednesday, 29th January, The Peninsula London will present a spirited Dragon Dance in the hotel’s graceful courtyard. This vibrant performance, believed to dispel negative energy and invite good fortune, will captivate guests with its colorful costumes and rhythmic drumming.</p>

<p>Celebrate the Year of the Snake—a symbol of wisdom, elegance, and transformation—at The Peninsula London. Whether you gather with loved ones for a sumptuous feast,",information/H2yEzZ9xrk.jpg,news,,,20 Dec 2024,2024-12-30 11:06:08,20 Dec 2024,en,,,,,100.0,,,,,,,,,,
,Experience the Lunar New Year Celebration at The Peninsula London!,Join us for a vibrant celebration of the Lunar New Year at The Peninsula London. Immerse yourself in a rich cultural experience filled with traditional festivities and culinary delights. Don't miss the chance to be part of this enchanting event that honors the spirit of the season.,experience-the-lunar-new-year-celebration-at-the-peninsula-london!,,"<p>Step into the enchanting world of Lunar New Year at The Peninsula London, where fascinating traditions and sophisticated hospitality come together in celebration of the Year of the Snake. From Saturday 18th January to Saturday 8th February, the hotel will offer an array of immersive experiences, from auspicious festivities to entertaining dining and cultural masterclasses, all inspired by The Peninsula’s rich Asian heritage.</p>

<p>A Feast of Fortune at ‘Canton Red’</p>

<p>For the Lunar New Year period, Canton Blue, The Peninsula’s refined Cantonese restaurant, will transform into 'Canton Red’ from 18th January – 8th February. Red is a sacred colour in Chinese culture, symbolising good fortune, prosperity, happiness, and vitality. The restaurant’s glossy blue entrance doors will be wreathed in red, and inside, the interiors will be decorated with vibrant, red florals and luminous Chinese lanterns. Canton Red invites diners to celebrate the Lunar New Year with an exclusive menu crafted to honour the season.</p>

<p>The festive menu features innovative interpretations of culturally significant dishes and includes a traditional red envelope for guests dining at Canton Red. On 29th January, a Chinese calligrapher will create bespoke messages of prosperity for the year ahead. The three-course set menu is available for £188 per person (exclusive of drinks) at both lunch and dinner sittings.</p>

<p>Discover the Art of Tea with Chinese Tea Ceremony Masterclasses</p>

<p>Canton Red’s elegant Tea Lounge will host daily Chinese tea masterclasses from 3:30 pm to 4:30 pm, starting Saturday 25th January through Wednesday 5th February. Led by The Peninsula London’s expert tea masters, each session includes tastings of three teas paired with light dim sum, pastries, and traditional sweets.</p>

<p>Participants will learn the history and techniques of this ancient ritual while experiencing its sensational flavours. This intimate experience is limited to eight participants per session and can be reserved on SevenRooms.com for £48 per person.</p>

<p>A Spectacle of Tradition: The Peninsula Dragon Dance</p>

<p>On Wednesday, 29th January, The Peninsula London will present a spirited Dragon Dance in the hotel’s graceful courtyard. This vibrant and dynamic performance is believed to dispel negative energy and invite good fortune, captivating guests with its colourful costumes and rhythmic drumming.</p>

<p>Celebrate the Year of the Snake—a symbol of",information/tq9d429JzO.jpg,news,,,20 Dec 2024,2024-12-30 11:11:15,20 Dec 2024,en,,,,,100.0,,,,,,,,,,
1.0,Compelling Summer Story Inspirations for Slow News Days 2024/2025,<p>Discover captivating narratives that can breathe life into quieter news cycles during the summer months of 2024 and 2025. These story ideas promise to engage audiences and spark conversations. Embrace the opportunity to explore unique themes that resonate during the slower news periods.</p>,compelling-summer-story-inspirations-for-slow-news-days-2024/2025,,"<p>We value your privacy. We and our 872 partners use cookies and other tracking technologies to improve your experience on our website. We may store and/or access information on a device and process personal data, such as your IP address and browsing data, for personalized advertising and content, advertising and content measurement, audience research, and services development. Additionally, we may utilize precise geolocation data and identification through device scanning.</p>

<p>Please note that your consent will be valid across all our subdomains. Once you give consent, a floating button will appear at the bottom of your screen, allowing you to change or withdraw your consent at any time. We respect your choices and are committed to providing you with a transparent and secure browsing experience.</p>

<p><strong>Cookie Categories</strong></p>

<p>This cookie is to support seamless flow and passing the search parameter from the website to the booking platform.</p>

<p>This cookie is used to sign in users to the membership program while making purchases. Description is currently not available.</p>

<p><strong>Purposes & Features</strong></p>

<p>Cookies, device or similar online identifiers can be stored or read on your device to recognize it each time it connects to an app or a website. This is done for various purposes, including recognizing your device each time you connect and providing personalized content.</p>

<p>There are numerous vendors seeking consent for advertising, content presentation, and audience research. Information about your activity on this service can be stored and combined with other data about you to build or improve a profile about you to present more relevant advertising.</p>

<p>Ads can be tailored based on your interests and previous activity, which may include forms you submit and content you view. Ads presented can be limited to ensure fewer repetitions.</p>

<p>For more information on how your data may be used for monitoring unusual activity, ensuring system security, and processing advertising, please visit our privacy policy.</p>

<p>Your choices regarding data processing and the purposes listed in this notice are recorded and respected. Different vendors are engaged in various purposes, ensuring transparency and user control over data usage.</p>

<p>In summary, your privacy is paramount. We strive to enhance your experience while prioritizing the safety and security of your personal information.</p>

<p><strong>FOR MORE INFORMATION CONTACT:</strong></p>
<p>Jodi Clark - TFE Hotels (Director of Communications)</p>
<p>jclark@tfe",information/ssHyPZnFsQ.jpg,,,,18 Dec 2024,2024-12-30 08:49:04,18 Dec 2024,en,,,,,100.0,,,,,,,,,,
1.0,Captivating Summer Story Concepts for Quiet News Days 2024/2025,<p>Explore intriguing narrative ideas perfect for the slower news cycles of the upcoming summer seasons. These concepts are designed to engage readers and provide fresh perspectives during quieter times. Discover how to bring captivating stories to life when headlines are scarce.</p>,captivating-summer-story-concepts-for-quiet-news-days-2024/2025,,"```html
<p>We value your privacy. We and our 872 partners use cookies and other tracking technologies to enhance your experience on our website. This may include storing and/or accessing information on your device and processing personal data, like your IP address and browsing data, for personalized advertising and content, along with advertising and content measurement, audience research, and development of services. Additionally, precise geolocation data and device identification through scanning may be utilized.</p>

<p>Your consent will be valid across all our subdomains. Once granted, a floating button will appear at the bottom of your screen, allowing you to change or withdraw your consent at any time. We are committed to respecting your choices and providing a transparent and secure browsing experience.</p>

<p>Cookies are categorized based on their purpose. For instance, some cookies support seamless flow and passing search parameters from the website to the booking platform. Others are designed to sign in users to membership programs when making purchases.</p>

<p>Cookies and similar online identifiers, along with additional information such as browser type, language, screen size, and supported technologies, can be stored on your device to recognize it each time it connects to an app or website.</p>

<p>Information about your activity on this service, including forms submitted and content viewed, can be stored and combined with other information about you, or similar users, to build or improve a profile that may reflect your interests and personal aspects. This profile can later be used to present advertising more relevant to your interests.</p>

<p>For advertising purposes, data may be based on your advertising profiles, which can reflect your activity on this service or other platforms. This may include the forms you submit and the content you engage with.</p>

<p>We collect information to understand how well ads work for you or other users, including whether you viewed or clicked on an ad and if it influenced your purchasing decisions. This data is essential for assessing the relevance of advertising campaigns.</p>

<p>Information regarding the content you interact with may also be used to determine if it reached its intended audience. This includes how long you engaged with non-advertising content, like articles or videos, and the pages visited.</p>

<p>Reports can be generated from combined data sets regarding user interactions to identify common characteristics and understand which target audiences are most receptive to specific campaigns.</p>

<p>Your data may also help monitor for and prevent unusual or potentially fraudulent activities, ensuring that systems and processes function properly and securely",information/uxbDQqUhRY.jpg,,,,18 Dec 2024 in the requested format is: 18 Dec 2024,2024-12-30 11:12:08,18 Dec 2024 in the requested format is: 18 Dec 2024,en,,,,,100.0,,,,,,,,,,
,Sonesta White Plains Downtown Unveils Stunning Revamp,"<p>Experience the transformation at Sonesta White Plains Downtown, where a remarkable redesign has taken place. This newly revamped hotel showcases modern elegance and comfort, inviting guests to enjoy a fresh stay. Discover the unique features and updated amenities that set this destination apart.</p>",sonesta-white-plains-downtown-unveils-stunning-revamp,,"<p>The centrally located Westchester Hotel has unveiled a renewed dynamic experience aimed at enhancing the stay for travelers. This revitalized establishment offers guests seamless access to both New York City and the beautiful Hudson Valley, making it an ideal choice for those looking to explore the region.</p>

<p>With its strategic location, the hotel provides an excellent base for visitors wishing to enjoy the vibrant culture and attractions of NYC, while also being in close proximity to the picturesque landscapes and outdoor activities of the Hudson Valley.</p>

<p>The hotel has undergone significant renovations to improve its facilities and services. Guests can expect modern amenities, stylish accommodations, and a welcoming atmosphere that caters to both leisure and business travelers.</p>

<p>One of the standout features of the renewed Westchester Hotel is its commitment to providing a unique and memorable experience. From upgraded room designs to enhanced dining options, every aspect of the hotel has been reimagined to meet the needs of today’s travelers.</p>

<p>In addition, the hotel has implemented various technological enhancements to ensure a smooth and convenient stay. This includes mobile check-in and smart room features that allow guests to customize their environment at the touch of a button.</p>

<p>For those planning to explore the surrounding areas, the hotel offers easy access to transportation options, including train services to NYC and local attractions. Guests can take advantage of curated excursion packages that highlight the best of both urban and natural experiences.</p>

<p>The Westchester Hotel also prides itself on its commitment to sustainability. Efforts have been made to reduce the hotel’s environmental footprint, including eco-friendly practices and locally sourced products in its dining options.</p>

<p>Whether you're visiting for business, leisure, or a mix of both, the revitalized Westchester Hotel promises a unique and convenient experience that connects you to the best of New York and the Hudson Valley.</p>

<p>In conclusion, the Westchester Hotel stands out as a premier choice for travelers seeking comfort and accessibility. With its renewed focus on guest experience and modern conveniences, it is set to become a favorite among those exploring this vibrant region.</p>",information/ii5Rke5Wa9.jpg,,,,10 Dec 2024,1735553580.4565032,10 Dec 2024,,,,,,100.0,,,,,,,,,,
